<?xml version="1.0" encoding="UTF-8"?>

<comp:Compensation-ML 
    xmlns:xsi="http://www.w3.org/2001/XMLSchema-instance"
    xmlns:comp="http://www.isac-net.org/std/Compensation-ML/v1.0/"
    xsi:schemaLocation="http://www.isac-net.org/std/Compensation-ML/v1.0/ ../schema/Compensation-ML.v1.0.xsd">
    
    <!-- Duplicate Ids -->
    
    <comp:spilloverMatrix comp:id="Fluor-PhyEry-Cy5PE-Compensation">
      
        <comp:spillover comp:parameter="Fluor">
            <comp:coefficient comp:parameter="PhyEry" comp:value="0.16501"/>
            <comp:coefficient comp:parameter="Cy5PE" comp:value="0.03457"/>
        </comp:spillover>
 
        <comp:spillover comp:parameter="PhyEry">
            <comp:coefficient comp:parameter="Fluor" comp:value="0.01454"/>
            <comp:coefficient comp:parameter="Cy5PE" comp:value="0.21343"/>
        </comp:spillover>
        
        <comp:spillover comp:parameter="Cy5PE">
            <comp:coefficient comp:parameter="Fluor" comp:value="0.0059"/>
            <comp:coefficient comp:parameter="PhyEry" comp:value="0.23623"/>
        </comp:spillover>
        
    </comp:spilloverMatrix>
    
    <comp:spilloverMatrix comp:id="Fluor-PhyEry-Cy5PE-Compensation">
        
        <comp:spillover comp:parameter="FITC">
            <comp:coefficient comp:parameter="FITC" comp:value="1"/>
            <comp:coefficient comp:parameter="PE" comp:value="0.15"/>
        </comp:spillover>
        
        <comp:spillover comp:parameter="PE">
            <comp:coefficient comp:parameter="FITC" comp:value="0.01"/>
            <comp:coefficient comp:parameter="PE" comp:value="1"/>
        </comp:spillover>
        
    </comp:spilloverMatrix>
    
    
</comp:Compensation-ML>
    
    